{
  "receipt_id": "RECEIPT-PILOT-0001",
  "task_id": "TASK-PILOT-0001",
  "lease_id": "LEASE-PILOT-0001",
  "agent_id": "worker-agent-id",
  "node_id": "node-local-pilot-01",
  "status": "done",
  "artifact_refs": [
    {
      "artifact_id": "ART-PILOT-0001",
      "type": "video",
      "uri": "artifacts/final.mp4",
      "sha256": "PLACEHOLDER_ARTIFACT_SHA256",
      "size_bytes": 0,
      "created_at": "2026-05-30T00:20:00Z",
      "media_duration_sec": 0,
      "producer_agent_id": "worker-agent-id",
      "task_id": "TASK-PILOT-0001"
    }
  ],
  "log_refs": [
    "logs/pipeline.log"
  ],
  "warnings": [],
  "errors": [],
  "guard_result": {
    "mode": "guarded_verify",
    "status": "pass",
    "blocking_violations": [],
    "warnings": []
  },
  "execution_hash": {
    "method": "sha256",
    "artifact_refs_hash": "PLACEHOLDER_ARTIFACT_REFS_HASH",
    "receipt_hash": "PLACEHOLDER_RECEIPT_HASH"
  },
  "generated_at": "2026-05-30T00:21:00Z",
  "source_refs": [
    "logs/pipeline.log",
    "bridge_objects/task_lease.json"
  ]
}
